data/processed/clases/Presentaciones_Prof_Max/capitulo-v-inteligencia-computacional_aestadiatico/tables/page007_table02.csv

Logit,Variable,Coeff.,Std. Err.,z-score,P>|z|
1,sex=male,-1.0866,0.4425,-2.4554,0.0141
2.1,cp=atyp_angina,1.3645,0.5185,2.6316,0.0085
2.2,cp=non_anginal,1.7781,0.4467,3.9807,6.87E-5
2.3,cp=typ_angina,1.645,0.5924,2.7771,0.0055
3,trestbps,-0.0188,0.0098,-1.9238,0.0544
4,exang=yes,-1.1993,0.3933,-3.0495,0.0023
5,ca,-1.2246,0.2228,-5.4976,3.85E-8
6.1,thal=normal,0.7039,0.71,0.9913,0.3215
6.2,thal=reversable_defect,-1.0013,0.7029,-1.4245,0.1543
,Constant,3.7425,1.6127,2.3207,0.0203

data/processed/clases/Presentaciones_Prof_Max/capitulo-v-inteligencia-computacional_aestadiatico/capitulo-v-inteligencia-computacional_aestadiatico.md

## Página 7

23-03-2017
7
Valor p, continuación:
Logit
Variable 
Coeff. Std. Err. 
z-score 
P>|z| 
8
thalach
0.018 
0.0112 
1.6034 
0.1088 
9
exang=yes 
-0.775 
0.4444 
-1.7439 
0.0812
10
oldpeak
-0.3676 
0.2316 
-1.5872 
0.1125 
11.1
slope=flat 
-0.6771 
0.8479 
-0.7985 
0.4246 
11.2
slope=up 
0.5866 
0.9185 
0.6387 
0.523 
12
ca
-1.3642 
0.2857 
-4.7747 
1.80E-6
13.1
thal=normal 
-0.0423 
0.791 
-0.0535 
0.9574 
13.2
thal=reversable_defect 
-1.4582 
0.7779 
-1.8744 
0.0609
Constant
2.8052 
2.8829 
0.973 
0.3305 
Observar Log-likelihood = ln(L)= -93.5797
Modelo 0: n0=160, n1=136, n=296
G=2(-93.58-(160ln160+136ln136-296ln296))
G=2(-93.58+1540.44)=2893.72. Dócima p(
)=0.000
Modelo muy bueno p<<0.05.
Pero hay que ver los test de coeficientes, Zwald, Eliminar
variables donde pWald>0.05.
2
12
χ
Usando KNIME para las 6 variables con p<0.05:
Cleveland-6-heart-disease Logistic Regressio
Log-likelihood = -108.2666, Number of iterations = 30
Logit
Variable 
Coeff. 
Std. Err. 
z-score 
P>|z| 
1
sex=male
-1.0866 
0.4425 
-2.4554 
0.0141 
2.1
cp=atyp_angina
1.3645 
0.5185 
2.6316 
0.0085 
2.2
cp=non_anginal 
1.7781 
0.4467 
3.9807 
6.87E-5 
2.3
cp=typ_angina 
1.645 
0.5924 
2.7771 
0.0055 
3
trestbps 
-0.0188 
0.0098 
-1.9238 
0.0544
4
exang=yes 
-1.1993 
0.3933 
-3.0495 
0.0023 
5
ca 
-1.2246 
0.2228 
-5.4976 
3.85E-8 
6.1
thal=normal 
0.7039 
0.71 
0.9913 
0.3215 
6.2
thal=reversable_defect 
-1.0013 
0.7029 
-1.4245 
0.1543 
Constant 
3.7425 
1.6127 
2.3207 
0.0203 
Observar Log-likelihood = ln(L)= -108.5797
Modelo 0: n0=160, n1=136, n=296
G=2(-108.58+1540.44)=2863.72. Dócima p(
)=0.000
Modelo muy bueno p<<0.05.
2
5
χ