data/processed/clases/Presentaciones_Prof_Max/capitulo-v-inteligencia-computacional_aestadiatico/tables/page006_table02.csv

Logit,Variable,Coeff.,Std. Err.,z-score,P>|z|
1,age,0.0152,0.025,0.6061,0.5444
2,sex=male,-1.672,0.5451,-3.0674,0.0022
3.1,cp=atyp_angina,0.7182,0.5676,1.2653,0.2058
3.2,cp=non_anginal,1.7939,0.5083,3.5293,0.0004
3.3,cp=typ_angina,2.0447,0.6718,3.0437,0.0023
4,trestbps,-0.0225,0.0114,-1.9823,0.0474
5,chol,-0.0042,0.0041,-1.0278,0.304
6,fbs=t,0.591,0.6128,0.9644,0.3349
7.1,restecg=normal,0.4175,0.3879,1.0761,0.2819
7.2,restecg=st_t_wave_abnormality,-0.4738,2.4689,-0.1919,0.8478

data/processed/clases/Presentaciones_Prof_Max/capitulo-v-inteligencia-computacional_aestadiatico/capitulo-v-inteligencia-computacional_aestadiatico.md

## Página 6

23-03-2017
6
Ej: Modelo para predecir enfermedad cardiaca, datos de Cliveland
Se cuenta con 296 casos obtenidos de la ciudad de Cliveland, con 14
atributos (originalmente 76). 13 características que inciden o son causa
de enfermedad cardiaca y la clase que corresponde a enfermedad o no.
Los atributos son:
Nº
Nombre
Característica
Nº
Nombre
Característica
1
age
Edad (años)
8
thalach
Infartos previos
2
sex
Sexo (0,1)
9
exang
Angina inducida 
por ejercicio (0,1)
3
cp
Dolor Pectoral (1-4)
10
oldpeak
Depresión segm. 
ST,  por ejercicio
4
trestbps
Presión Sanguínea 
(mmHg)
11
slope
Pendiente segm. 
ST por ejerc. (1-3)
5
chol
Colesterol Sérico (mg/dl)
12
ca
Nº vasos 
coloreados por 
fluoroscopia (0-3)
6
fbs
Glucosa ayunas (0,1)
13
thal
Defectos cardiacos 
en ejercicio (1-3)
7
restecg
ECG reposo (0-2)
14
num
Diagnostico de 
enfermedad (0,1)
Solución:
Se transforman los datos en formato .rtff, se leen con el programa
KNIME y se realiza regresión logística con atributo num como la clase
Logit
Variable 
Coeff. Std. Err. z-score 
P>|z| 
1
age
0.0152 
0.025 
0.6061 
0.5444 
2
sex=male
-1.672 
0.5451 -3.0674 
0.0022
3.1
cp=atyp_angina
0.7182 
0.5676 
1.2653 
0.2058
3.2
cp=non_anginal
1.7939 
0.5083 
3.5293 
0.0004
3.3
cp=typ_angina
2.0447 
0.6718 
3.0437 
0.0023
4
trestbps
-0.0225 
0.0114 -1.9823 
0.0474
5
chol 
-0.0042 
0.0041 -1.0278 
0.304 
6
fbs=t 
0.591 
0.6128 
0.9644 
0.3349 
7.1
restecg=normal 
0.4175 
0.3879 
1.0761 
0.2819 
7.2
restecg=st_t_wave_abnormality -0.4738 
2.4689 -0.1919 
0.8478 
Cleveland-14-heart-disease Logistic Regression, KNIME
Log-likelihood = -93.5797,  Number of iterations = 30, Logit 50
Las variables mas significantivas tienen p<0.05.